ques,factoid_ans,target-1,target-2,target-3,target-4
when was amber last seen ?,"walking alone to school on february 13 , 2009","amber was last seen walking alone to school on february 13 , 2009 .",,,
what are u.s. vessels at mercy of ?,pirates,u.s. vessels are at the mercy of pirates .,,,
what do reports accuse isreal of ?,war crimes during its military offensive in gaza last winter,reports accuse isreal of war crimes during its military offensive in gaza last winter .,reports have accused it of war crimes during its military offensive in gaza last winter .,,
under which rule was the papers released ?,30-year,the papers was released under 30-year rule,the papers were released under 30-year rule .,,
what study suggested only 20 % was recycled safely ?,greenpeace,greenpeace suggested only 20 % was recycled safely .,greenpeace study suggested only 20 % was recycled safely .,,
who have drawn ocriticizm from muslim groups ?,sania mirza,sania mirza have drawn ocriticizm from muslim groups .,sania mirza has drawn ocriticizm from muslim groups .,,
what did ocampo say should be added to al-bashir 's charges ?,genocide,ocampo said genocide should be added to al-bashir 's charges .,,,
how many girls were returned to their families ?,eight or nine young,eight or nine young girls were returned to their families .,,,
who did obama receive endorsement from ?,robert reich,obama received endorsement from robert reich .,obama received an endorsement from robert reich .,,
at least how many were wounded in the fighting ?,80,at least 80 were wounded in the fighting .,at least 80 people were wounded in the fighting .,,
who anticipated slaying by government forces ?,lasantha wickrematunga .,lasantha wickrematunga anticipated slaying by government forces .,,,
what is ' biochar ' ?,a highly porous charcoal made from organic waste ., biochar ' is a highly porous charcoal made from organic waste .,biochar is a highly porous charcoal made from organic waste .,,
where did the video appear ?,youtube,the video appeared on youtube .,,,
where is the storm expected to move ?,north-northwest motion and approach the southwestern tip of baja california,the storm is expected to move in a north-northwest motion and approach the southwestern tip of baja california .,the storm is expected to move north-northwest and approach the southwestern tip of baja california .,,
whom do the new mothers feed ?,several infants who were separated from their mothers or orphaned,the new mothers feed several infants who were separated from their mothers or orphaned .,,,
removal of which item of clothing is expected to remain in place at security ?,shoes,removal of shoes is expected to remain in place at security .,removal of shoes item of clothing is expected to remain in place at security .,,
what does he plan to study in college ?,sociology,he plans to study sociology in college .,he does plan to study sociology in college .,,
"how much did j.j. abrams ' "" star trek "" gross from friday to sunday ?",$ 72.5 million,"j.j. abrams ' "" star trek "" gross from friday to sunday was $ 72.5 million .","j.j. abrams ' "" star trek "" grossed $ 72.5 million from friday to sunday .",,
what was isaac toussie involve in ?,long island mortgage fraud scheme .,isaac toussie was involved in the long island mortgage fraud scheme .,isaac toussie was involve in long island mortgage fraud scheme .,,
who nomiated mukasey ?,president bush,president bush nomiated mukasey .,,,
what did researchers say was the starting point ?,bluestonehenge,researchers said that the starting point was bluestonehenge .,,,
who sang for a pepsi-cola commercial in 1984 ?,michael jackson,michael jackson sang for a pepsi-cola commercial in 1984 .,,,
whose program includes a speech from a former prostitute ?,john school,john school 's program includes a speech from a former prostitute .,john school program includes a speech from a former prostitute .,,
who is lang lang ?,chinese child prodigy,lang lang is a chinese child prodigy .,,,
what did russian officials allow cnn to see ?,copy of a letter addressed,russian officials allowed cnn to see a copy of the letter addressed .,russian officials allow cnn to see a copy of a letter addressed .,,
what is the age of president ?,58,the president is 58 years of age .,the age of president is 58 .,,
who was fined by thai court ?,dozens of rohingya refugees from myanmar,dozens of rohingya refugees from myanmar was fined by thai court .,dozens of rohingya refugees from myanmar were fined by thai court .,,
what is the name of the new system ?,the joint virtual lifetime electronic record,the name of the new system is the joint virtual lifetime electronic record .,,,
what is india considering ?,suspending the five-year-old cease-fire with pakistan,india is considering suspending the five-year-old cease-fire with pakistan .,,,
what is the name of the remote-controlled machine that sent back video from the tasman fracture ?,jason,jason is the name of the remote-controlled machine that can sent back video from the tasman fracture .,the name of the remote-controlled machine that sent back video from the tasman fracture is jason .,,
who unveils the proposal ?,sepp blatter,sepp blatter unveils the proposal .,,,
what was voted as britain 's ugliest building ?,the bullring shopping centre in birmingham,the bullring shopping centre in birmingham was voted as britain 's ugliest building .,,,
what is mentally competent ?,21-year-old idaho man charged with trying to assassinate president obama,the 21-year-old idaho man charged with trying to assassinate president obama is mentally competent .,mentally competent is a 21-year-old idaho man charged with trying to assassinate president obama .,,
who used her own name ?,his wife,his wife used her own name .,,,
who announced he will run for president ?,"sen . benigno "" noynoy "" aquino iii","sen . benigno "" noynoy "" aquino iii announced he will run for president .",,,
what did seymore say we want to relive ?,"michael jackson 's youth ,",seymore said that we want to relive michael jackson 's youth .,michael jackson 's youth said seymore that we want to relive .,,
what does batt believe is beneficial ?,""" we have to work toward acceptance on all levels , ""","batt believes that "" we have to work toward acceptance on all levels "" is beneficial .",""" we have to work toward acceptance on all levels , "" batt believe is beneficial .",,
who runs the celebrity 100 list ?,forbes,forbes runs the celebrity 100 list .,,,
what did the posts say about islam ?,""" loneliness leads me to other problems ""","the posts said "" loneliness leads me to other problems "" .","the posts say about islam "" loneliness leads me to other problems "" .",,
what is education the key to ?,a medical school,education is the key to a medical school .,,,
what advantage will january shoppers have ?,rock-bottom prices,january shoppers have rock-bottom prices .,"in january , shoppers have rock-bottom prices .",rock-bottom prices advantage will january shoppers have .,
what was the world 's ugliest building on the forbes list ?,the bullring shopping centre,the bullring shopping centre was the world 's ugliest building on the forbes list .,the world 's ugliest building on the forbes list was the bullring shopping centre .,,
how long is the cable ?,"17,000 kilometer","the cable is 17,000 kilometer .",,,
what is the rule ?,"containers no larger than 3 ounces are allowed in carry-on luggage , provided they are packed into one quart-size clear plastic zip-top bag , with one bag allowed per person .","the rule is that containers no larger than 3 ounces are allowed in carry-on luggage , with one bag allowed per person .","The rule is that containers no larger than 3 ounces are allowed in carry-on luggage , provided they are packed into one quart-size clear plastic zip-top bag , with one bag allowed per person .",,
who pleaded guilty to illegally entering senator 's office ?,james o 'keefe,james o 'keefe pleaded guilty to illegally entering senator 's office .,James o 'keefe pleaded guilty to illegally entering the senator 's office .,,
how many strollers were affected by the recall ?,one million,one million strollers were affected by the recall .,,,
in which publication did the article appear ?,wednesday 's wall street journal,the article appeared in wednesday 's wall street journal .,,,
what does abby miller do ?,sings for her friend taylor love,abby miller sings for her friend taylor love .,,,
what kind of treatment is there for a silent heart attack ?,"beta blockers , statin drugs , aspirin or other medications","there is beta blockers , statin drugs , aspirin or other medications , for a silent heart attack .","treatment for a silent heart attack are beta blockers , statin drugs , aspirin or other medications .",,
what is the rating of sixth album ?,"flat , but a hit with teens","the rating of sixth album is flat , but a hit with teens .","The rating of the sixth album is flat , but a hit with the teens .",,
what kind of clothes did renee zellweger wear for her role ?,from the early 50s,renee zellweger wear clothes from the early ' 50s for her role .,,,
where did errol barnett have an encounter with a bull elephant ?,mosi-oa-tunya national park in zambia,errol barnett had an encounter with a bull elephant in zambia .,Errol Barnett had an encounter with a bull elephant at mosi-oa-tunya national park in Zambia .,,
where was the system previously tested ?,"several u.s. airports including minneapolis-st . paul , minnesota ; denver , colorado ; and boston , massachusetts","the system was previously tested at several u.s. airports including minneapolis-st . paul , minnesota ; denver , colorado , colorado ; and boston , massachusetts .",,,
what was the death toll ?,90,the death toll was 90 .,,,
who was attacked ?,rihanna,rihanna was attacked .,,,
how many dead in flood ?,two,two are dead in the flood,Two people died in the flood .,,
what people were the detectives in a major cop drama ?,warren kole and michael ealy,warren kole and michael ealy were the detectives in a major cop drama .,The detectives in a major cop drama were Warren Kole and Michael Ealy .,,
what is the number of the employees ?,"67,100","the number of the employees is 67,100 .",,,
where does the team rank ?,second from the bottom of the german bundesliga,the team ranks second from the bottom of the german bundesliga .,The team does rank second from the bottom of the German bundesliga .,,
where is reinhold messner from ?,italian,reinhold messner is italian .,reinhold messner is from italy .,,
who in isaac toussie 's family might have been responsible for him getting pardoned ?,father,isaac toussie 's father might have been responsible for him getting pardoned,,,
who was captured monday 8 miles from prison ?,three inmates,three inmates were captured on monday 8 miles from prison .,,,
"who said "" being in eternal city gave film feeling it could n't get on back lot "" ?",tom hanks,"tom hanks said "" being in eternal city gave film feeling it could n't get on back lot .","Tom Hanks said "" being in the eternal city gave the film the feeling it ca n't get on back lot "" .",,
how did corey smith and marquis cooper go missing ?,boat,corey smith and marquis cooper went missing on a boat .,Corey Smith and Marquis Cooper went missing by boat .,,
where did natasha richardson sail ?,caribbean,natasha richardson sailed in the caribbean .,,,
where can the device currently only be used ?,at & t. a,the device can currently only be used at & t. a .,at & t. a can the device currently only be used .,,
who scores only goal to give palermo a 1 - 0 victory over livorno ?,fabrizio miccoli,fabrizio miccoli scores only goal to give palermo a 1 - 0 victory over livorno .,,,
what did alvaro uribe say ?,he 's releasing the information to help the government 's fight against fraud,alvaro uribe said he 's releasing the information to help the government 's fight against fraud .,,,
when did edo become tokyo ?,1868,edo became tokyo in 1868 .,,,
what was the problem ?,"hundreds of poor , rural and indigenous pregnant women are dying because they are being denied the same health services as other women in the country","the problem was that hundreds of poor , rural and indigenous pregnant women are dying because they are being denied the same health services as other women in the country .","The problem is hundreds of poor , rural and indigenous pregnant women are dying because they are being denied the same health services as other women in the country .",,
what is the court determining ?,decision will determine whether politically charged documentaries can be regulated by the government in the same way as traditional campaign commercials,the court will determine whether politically charged documentaries can be regulated by the government in the same way as traditional campaign commercials .,,,
what did the us stafe department say that cuba rejected ?,u.s. assistance,the us stafe department say that cuba rejected u.s. assistance .,The US stafe department said that Cuba rejected U.S. assistance .,,
what is the governments rule for liquids and gels ?,containers no larger than 3 ounces are allowed in carry-on luggage,the governments rule for liquids and gels is that containers no larger than 3 ounces are allowed in carry-on luggage .,The government 's rule for liquids and gels is that containers no larger than 3 ounces are allowed in carry-on luggage .,,
who lived for a month on food-stamp budget ?,sean callebs,sean callebs lived for a month on food-stamp budget .,sean callebs lived for a month on a food - stamp budget .,,
what is included in the list ?,best-kept-secret careers,best-kept-secret careers is included in the list .,,,
what first lady honored women 's rights heroes ?,obama,obama honored women 's rights heroes .,Obama first lady honored women 's rights heroes .,,
how many years were they imprisoned ?,three,they were imprisoned for three years .,,,
what did laura bush call on myanmar junta to do ?,""" step aside , ""","laura bush called on myanmar junta to "" step aside , ""","Laura Bush called on the Myanmar junta to "" step aside , "" .",,
what cities have the highest quality of living ?,"vienna , austria","the cities of vienna , austria , have the highest quality of living .","The highest quality of living is in Vienna , Austria .",,
what will you learn ?,there is an economic role for government in a market economy whenever the benefits of a government policy outweigh its costs .,you will learn that there is an economic role for government in a market economy whenever the benefits of a government policy outweigh its costs .,,,
who left millions to their dogs ?,leona helmsley,leona helmsley left millions to their dogs .,,,
what is number of people slaughtered ?,"8,000","number of people slaughtered is 8,000 .",,,
what did officials say the terrorists are armed with ?,"hand grenades , bombs","officials said the terrorists are armed with hand grenades , bombs .",,,
what is a meat cube ?,"d slam , which is four patties stacked on a bun",a meat cube is four patties stacked on a bun .,"A meat cube is d slam , which is four patties stacked on a bun .",,
what did scientists say ?,debris wo n't threaten the international space station,scientists said that debris wo n't threaten the international space station .,Scientists say debris wo n't threaten the international space station .,,
who walked kate down the aisle at her wedding ?,mike,mike walked kate down the aisle at her wedding .,,,
what is the key to solving spain 's problems ?,a grand rethink of the whole euro currency project,the key to solving spain 's problems is a grand rethink of the whole euro currency project .,,,
where is mohammed 's home ?,"mumbai , india 's , garib nagar","mohammed 's home is at mumbai , india 's , garib nagar .","Mohammed 's home is in Mumbai , India , Garib Nagar .",,
what was the strength of the earthquake in the indian ocean ?,7.6-magnitude,the strength of the earthquake in the indian ocean was 7.6-magnitude .,,,
hleb was expected to be part of what ?,the swap deal that saw zlatan ibrahimovic and samuel eto 'o switch clubs,hleb was expected to be part of the swap deal that saw zlatan ibrahimovic and samuel eto 'o switch clubs .,,,
what kercher 's mother says ?,""" it is n't just the dna or on one specific thing , ""","kercher 's mother says that "" it is n't just the dna or on one specific thing , """,""" It is n't just the dna or one specific thing , "" Kercher 's mother says .",,
what led to the release ?,clerical error,clerical error led to the release .,A clerical error led to the release .,,
who was the striker ?,robin van persie,the striker was robin van persie .,,,
what kind of evidence was found ?,images of the small girl being sexually assaulted,images of the small girl being sexually assaulted was found .,images of the small girl being sexually assaulted kind of evidence was found .,,
ferrari president accuses critics of victory ?,hypocrisy .,ferrari president accuses critics of victory is hypocrisy .,,,
which transport has proved a success ?,"city 's cheap bike-hire scheme , velib ,","the city 's cheap bike-hire scheme , velib , has proved a success .","city 's cheap bike-hire scheme , velib , has proved a success .",,
does the film contain sex scenes ?,distinct lack of on-screen,the film contain a distinct lack of on-screen sex scenes .,,,
perlitz faces how many counts ?,10,perlitz faces 10 counts .,,,
who hopes to increase number of mental health providers in the field ?,army,army hopes to increase number of mental health providers in the field .,The army hopes to increase the number of mental health providers in the field .,,
nasa 's plans suffer from what ?,set-back .,nasa 's plans suffer from a set-back .,,,
who was evacuated from the building ?,the 32-floor,the 32-floor was evacuated from the building .,,,
what is being canceled ?,"3,000 u.s. troops","3,000 u.s. troops is being canceled .","3,000 u.s. troops are being canceled .",,
what does president obama want to keep americans aware of ?,"issues like jobs , education and health care","president obama wants to keep americans aware of issues like jobs , education and health care .","President Obama does want to keep Americans aware of issues like jobs , education and health care .",,
what is considered much broader than a public rift between the two men ?,abortion,abortion is considered much broader than a public rift between the two men .,,,
they are ahead of what groups ?,"people fleeing wars in afghanistan and somalia ,",they are ahead of people fleeing wars in afghanistan and somalia .,,,
israel scolds whom ?,mckinney,israel scolds mckinney .,,,
who is man united ?,manchester,man united is manchester .,,,
who was among the dignitaries at inauguration ?,latin american leaders and u.s. secretary of state hillary clinton,latin american leaders and u.s. secretary of state hillary clinton was among the dignitaries at inauguration .,"Among the dignitaries at the inauguration were Latin American leaders and the U.S. secretary of state , Hillary Clinton .",,
who is at high risk for death due to cholera ?,- - people,the - - people are at high risk for death due to cholera .,the people are at high risk for death due to cholera .,,
which social networks are wealthier people more likely to use ?,facebook,wealthier people are more likely to use facebook .,,,
who are charged with eight felonies ?,nicole smith 's longtime partner and attorney howard k. stern and two doctors,nicole smith 's longtime partner and attorney howard k. stern and two doctors are charged with eight felonies .,"Nicole Smith 's longtime partner and attorney , Howard K. Stern , and two doctors are charged with eight felonies .",,
what led her to more eating ?,the thyroid diagnosis,the thyroid diagnosis led her to more eating .,,,
where was charles smith captured ?,about eight miles away in southwestern michigan,charles smith was captured about eight miles away in southwestern michigan .,,,
what can poetry provide ?,look at the world from a slightly different angle,poetry can provide look at the world from a slightly different angle .,looking at the world from a slightly different angle is what poetry provides .,,
where did the prince also visit ?,kabul,the prince also visited kabul .,,,
what is the name of the fishing vessel ?,katmai,the name of the fishing vessel is katmai .,,,
what was gullberg 's cause of death ?,hypothermia,gullberg 's cause of death was hypothermia .,,,
how many people have been indicted and prosecuted ?,20,about 20 people have been indicted and prosecuted .,20 people have been indicted and prosecuted .,,
who is living in jordan ?,raghad hussein,raghad hussein is living in jordan .,,,
what did criminals block ?,roads,criminals block roads .,,,
who ruled an empire stretching from the gulf of mexico to the pacific ocean ?,the aztecs,the aztecs ruled an empire stretching from the gulf of mexico to the pacific ocean .,,,
what does steven gerrard deny ?,assaulting a man,steven gerrard deny assaulting a man .,,,
what was being smuggled ?,contraband,contraband was being smuggled .,,,
who have the highest quality of life ?,vienna,vienna have the highest quality of life .,The highest quality of life is in Vienna .,,
who is charged with trespassing into a restrictive area ?,"the american visitor , john yettaw ,","the american visitor , john yettaw , is charged with trespassing into a restrictive area .",,,
who closed streets ?,police,police closed streets .,,,
what have police recovered ?,two of the four impressionist paintings stolen,police have recovered two of the four impressionist paintings stolen .,,,
what are perfectly acceptable ?,separates,separates are perfectly acceptable .,perfectly acceptable are separates .,,
who issued a recall ?,infantino,infantino issued a recall .,,,
who will become the first south korean to play in the final ?,park ji-sung,park ji-sung will become the first south korean to play in the final .,,,
how many americans smoke ?,4.5 million,4.5 million americans smoke .,,,
how many chinese muslims remain at gitmo ?,thirteen,about thirteen chinese muslims remain at gitmo .,Thirteen Chinese muslims remain at Gitmo .,,
what happened to some christian priests and missionaries ?,abuse,some christian priests and missionaries were abused .,Abuse happened to some Christian priests and missionaries .,,
who has her style been compared with ?,"mariah , madonna","her style has been compared with mariah , madonna.",,,
who did chiquita admit paying ?,autodefensas unidas de colombia,"chiquita admit paying autodefensas unidas de colombia ,",,,
who is head of tripoli operations ?,lt . colonel mustapha nooh,the head of tripoli operations is lt . colonel mustapha nooh .,,,
what is just one strategy to achieve goals in afghanistan ?,reverse the taliban 's momentum,one strategy to achieve goals in afghanistan is to just reverse the taliban 's momentum .,reverse the taliban 's momentum is just one strategy to achieve goals in Afghanistan .,,
how many cases of unruly behaviour did faa report ?,900,faa reported 900 cases of unruly behaviour .,faa reported 900 cases,,
who was in the collaboration ?,lang lang,lang lang was in the collaboration .,,,
was her application accepted ?,granted conditional release,her application was accepted and she was granted conditional release .,Her application was accepted .,,
who credits obama with pulling back economy from disaster ?,valerie jarrett,valerie jarrett credits obama with pulling back economy from disaster .,Valerie Jarrett credits Obama with pulling the economy from disaster .,,
what did the media say ?,encountered problems shortly after takeoff,the media said that they encountered problems shortly after takeoff .,The media say they encountered problems shortly after takeoff .,,
what army rank is edwin donayre ?,general,edwin donayre is a general .,,,
medicare is a strong case of what ?,government playing a positive role in health care,medicare is a strong case of government playing a positive role in health care .,,,
what tv show is bryan batt on ?,""" mad men ""","bryan batt on "" mad men , """,,,
who was involved in the shootout ?,blackwater personnel,blackwater personnel was involved in the shootout .,Blackwater personnel were involved in the shootout .,,
what did bush say it was a reminder of ?,we are at war with extremists,bush said it was a reminder of we are at war with extremists .,,,
some have viewed stonehenge as what ?,part of a funeral complex,some have viewed stonehenge as part of a funeral complex .,,,
what two groups are fighting in northern ireland ?,catholic and protestant,catholic and protestant are fighting in northern ireland .,,,
what bridge has been debated ?,indian street,indian street has been debated .,,,
where are the malicious software being planted ?,twitter,the malicious software being planted in twitter .,,,
can the affects be undone ?,a cut of 40 percent in carbon emissions by 2020 is vital to avoid severe repercussions,a cut of 40 percent in carbon emissions by 2020 is vital to avoid severe repercussions and for the effects to be undone .,,,
who founded teh america 's promise alliance to support youth ?,colin powell,colin powell founded teh america 's promise alliance to support youth,,,
where is the breach said to have taken place ?,kashmir,the breach is said to have taken place in kashmir .,The breach is said to have affected Kashmir .,,
what did her father accuse her husband 's administration of doing ?,""" trades appointments to commissions for checks for $ 50,000 ""","her father accuse her husband 's administration of doing "" trades appointments to commissions for checks for $ 50,000 "" .",,,
