ques,factoid_ans,target-1,target-2,target-3,target-4
what did luxembourg score ?,ranked highest in personal safety,luxembourg ranked highest in personal safety .,,,
what remain missing ?,"degas ' "" count lepic and his daughters "" and cezanne 's "" boy in a red vest .""","degas ' "" count lepic and his daughters "" and cezanne 's "" boy in a red vest . "" remain missing .",,,
who does obama scores win with ?,women voters,obama scores win with women voters .,,,
by how much does the bill cut the deficit over the next 10 years ?,$ 138 billion,the bill cuts the deficit over the next 10 years by $ 138 billion .,The bill will cut the deficit over the next 10 years by $ 138 billion .,,
who attacked the us embassy ?,al qaeda militants,al qaeda militants attacked the us embassy .,,,
who was detained ?,ahmed al-omran,ahmed al-omran was detained .,,,
the children have been a victim of what ?,bloody conflict between security forces and anti-government demonstrators,the children have been a victim of what bloody conflict between security forces and anti-government demonstrators .,a victim of a bloody conflict between security forces and anti-government demonstrators .,,
who has a warning to parents ?,food and drug administration,the food and drug administration has a warning to parents .,,,
what are death sentence down to,78 people,death sentences are down to 78 people .,,,
where was the site of bloody fighting between zetas ?,"the area , which borders texas","the site of bloody fighting between zetas is the area , which borders texas .",,,
what does the grateful dead plan ?,new tour,the grateful dead plan is a new tour .,The grateful dead are planning a new tour .,,
what did larry langford engage in ?,criminal activity,larry langford engaged in criminal activity .,,,
what did chinese authorities confirm ?,captive animals in two of china 's major panda reserves were alive,chinese authorities confirmed that captive animals in two of china 's major panda reserves were alive .,,,
what did hannah kerney claim ?,a first gold medal in saturday 's final event,hannah kerney claim a first gold medal in saturday 's final event .,,,
how many men were accomplices ?,four,four men were accomplices .,There were four .,,
who began the sunrise ceremonies ?,robert baden-powell,robert baden-powell began the sunrise ceremonies .,,,
what age is russell 's boy ?,year and a half,russell 's boy is a year and a half .,,,
what the discoveries include ?,"new , purple-spotted sea anemone","the discoveries include new , purple-spotted sea anemone .","new , purple-spotted sea anemone is what the discoveries includes .",,
federal investagators are involved why ?,fourteenth suspicious fire in a month 's time,federal investagators are involved because of fourteenth suspicious fire in a month 's time .,,,
what does obama need ?,to be wary of alienating teachers who can be his allies on education reform,obama needs to be wary of alienating teachers who can be his allies on education reform .,to be wary of alienating teachers who can be his allies on education reform is what Obama needs .,,
what was tokyo known as prior to 1868 ?,edo,"prior to 1868 , tokyo was known as edo",,,
what ew said about ` amelia ` hits ?,"is a frustratingly old-school , hollywood-style ,","ew said that  "" amelia "" hits  is a frustratingly old-school , hollywood-style .","a frustratingly old-school , hollywood-style , ew said about ` amelia ` hits.",,
which vehicle has the right of way on narrow lanes in italy ?,larger,larger vehicle has the right of way on narrow lanes in italy .,the right of way on narrow lanes in italy has larger vehicle .,,
whats the best solution according to phillips ?,provide military escorts for international shipping vessels,"according to phillips , the best solution is to provide military escorts for international shipping vessels .",provide military escort for international shipping vessels is the best solution according to phillips .,,
who was named to time 100 most influential list ?,"behar and her co-hosts on "" the view ""","behar and her co-hosts on "" the view "" was named to time 100 most influential list .","Behar and her co-hosts on "" The View "" were named to time 's 100 most influential list.",,
what was the two suspects arrested for ?,killing of six african immigrants in castelvolturno,the two suspects arrested for killing of six african immigrants in castelvolturno .,,,
where are more students leaving to study ?,mainland,more students are leaving to study in the mainland,,,
what did mulgrew say the nation must commit to develop a treatment ?,a major national investment,mulgrew said that the nation must commit to develop a major national investment .,"A major national investment , Mulgrew said the nation must commit to developing treatment .",,
what is a health problem ?,secondhand smoke,secondhand smoking is a health problem .,A health problem is secondhand smoke.,,
what is the name of the rebel group ?,the lord 's resistance army ( lra ),the rebel group is the lord 's resistance army ( lra ) .,The name of the rebel group is the Lord 's Resistance Army ( lra ) .,,
what does jennifer granholm say about the auto industry ?,we are doing everything we can to become the home of this new electric,jennifer granholm said we are doing everything we can to become the home of this new electric .,Jennifer Granholm does say about the auto industry that we are doing everything we can to become the home of this new electric.,,
what does the crew claim are tied to a lawsuit ?,""" knowingly sent their employees into pirate-infested waters , rather than taking safer routes . ""","the crew claim that "" knowingly sent their employees into pirate-infested waters , rather than taking safer routes . "" .","the crew claim are tied to a lawsuit "" knowingly sent their employees into pirate-infested waters , rather than taking safer routes . "" .",,
what did the law ban ?,transplants for money,the law banned transplants for money .,,,
who did carson motivate ?,others,carson motivated others .,,,
what animal is being used in libraries to increase children 's comfort with reading ?,dogs,dogs is being used in libraries to increase children 's comfort with reading .,,,
"who said that "" our operations are strong . "" ?",mary l. jeffries,"mary l. jeffries said that "" our operations are strong . """,,,
what is her sixth album ?,""" talk that talk , ""","her sixth album is "" talk that talk , "" .",,,
what hotels were hit in jakarta ?,ritz-carlton,hotels such as ritz-carlton were hit in jakarta .,The Ritz-carlton hotels were hit in Jakarta.,,
what caused serbian defender to sit out ?,suffering concussion,concussion caused serbian defender to sit out .,Suffering concussion caused the Serbian defender to sit out.,,
what city ranks last in quality of living and safety ?,baghdad,baghdad ranks last in quality of living and safety .,Baghdad city ranks last in quality of living and safety .,,
what did yanis plan to do ?,""" shoot students in the school and then himself ""","yanis plan to "" shoot students in the school and then himself """,,,
who scored for napoli against atalanta ?,edinson cavani,edinson cavani scored for napoli against atalanta .,,,
who did suzman campaign to be released ?,one of the first people,suzman campaigned for one of the first people to be released .,Suzman campaigned to be released as one of the first people .,,
who does renee zellweger play ?,woman based on george hamilton 's mother,renee zellweger plays a woman based on george hamilton 's mother .,Renee Zellweger does play a woman based on George Hamilton 's mother .,,
where are the engines ?,on the river bottom,the engines are on the river bottom .,,,
whose comments are a reaction ?,al-libi 's,al-libi 's comments are a reaction .,a reaction is al-libi 's comments .,,
what is the agency beset by ?,cronyism,cronyism ; the agency beset by cronyism .,The agency is beset by cronyism .,,
what is diane black head of ?,senate republican caucus .,diane black is head of senate republican caucus .,,,
who played jim phelps on mission : impossible ?,actor peter graves,actor peter graves played jim phelps on mission : impossible .,,,
clarkson 's voice is made for what kind of songs ?,anthems,clarkson 's voice is made for anthems,Clarkson 's voice is made for anthems kind of songs .,,
has china ever won and oscar ?,the country,china has won an oscar for the country .,,,
who is the founder and ceo of biocon ?,kiran mazumdar-shaw,kiran mazumdar-shaw is the founder and ceo of biocon .,The founder and ceo of Biocon is Kiran mazumdar-shaw .,,
where is camden hills state park ?,maine,camden hills state park is in maine .,,,
how many children await aid ?,nearly 100,nearly 100 children await aid .,,,
what did joan rivers say about life ?,""" how lucky i am ""","joan rivers said "" how lucky i am "" about life .","Joan Rivers says about life "" how lucky I am "" .",,
is it a horror movie ?,strange kind of,it is a strange kind of horror movie .,It is a horror movie .,,
what is the bluestonehenge name for ?,"the new find , dubbed "" bluestonehenge "" after the color of the 25 welsh stones of which it was once","the bluestonehenge name is for the new find , dubbed "" bluestonehenge "" after the color of the 25 welsh stones of which it was once .","The bluestonehenge name is a new find , dubbed "" bluestonehenge "" after the color of the 25 welsh stones of which it was once .",,
"how many electoral votes did obama 's opponent have , according to this reading ?",349 - 163,"obama 's opponent had 349 - 163 , according to this reading .","Obama 's opponents had , according to this reading , 349 - 163 .",,
what is the decision of patrick vieira ?,move from juventus,patrick vieira 's decision is to move from juventus .,The decision of Patrick Vieira is to move from Juventus .,,
who has comply ?,iran,iran has to comply .,Iran has comply .,,
what is the status of the case ?,all of the nine men arrested on thursday october 6 as part of an investigation into suspicious betting activity have now been released on police bail pending further inquiries,the status of the case is that all nine men arrested on thursday october 6 as part of an investigation into suspicious betting activity have now been released on police bail pending further inquiries .,,,